{"blockers":[{"code":"loss-uma-gated-card-unavailable","description":"The provider document projection has an unresolved blocking official-document loss: uma-gated-card-unavailable.","dimension":"loss-closure"},{"code":"loss-uma-weight-hashes-unavailable","description":"The provider document projection has an unresolved blocking official-document loss: uma-weight-hashes-unavailable.","dimension":"loss-closure"}],"contract_name":"document-slice-manifest","corpus_ref":{"corpus_id":"ml-potential-workflows-uma-models-official-corpus","sha256":"7647b8bb5e31daade12cd62319638709af4748418ad2d0d61fe7d2ab1213d85c"},"limitations":["All provider inputs are external metadata receipts; official documentation bodies are not bundled.","FairChem v1, FairChem v2, UMA model artifacts, datasets, and reference-DFT identities are intentionally separate.","MACE framework and docs revisions and source identities are intentionally separate.","No model-card body, reference configuration, checkpoint byte hash, or model execution evidence exists.","No provider framework, checkpoint, dataset, archive, notebook, pickle, or serialized asset is imported, downloaded, opened, deserialized, or executed.","Only a public metadata response is recorded.","Slice projections are validated against the provider source partition.","The inventory identity binds the exact pre-migration catalog bytes as migration metadata; it does not identify any upstream document body."],"producer":{"generated_utc":"2026-07-24T00:00:00Z","skill_id":"ml-potential-workflows","skill_version":"1.0","tool_id":"official-document-pack-builder","tool_version":"1.0"},"schema_version":"1.1","slice_manifest_id":"ml-potential-workflows-uma-models-official-slices","sources":{"uma-public-api-metadata":{"processor":{"assurance_mode":"pinned","attestations":[{"artifact":{"bytes":184689,"path":"tools/build_official_document_packs.py","sha256":"8f324b8bcf6881027f873838aa72df73f1b8029d7f77cc8fff1740215e40d4fc"},"attestation_id":"official-document-pack-transformer-implementation","kind":"implementation"},{"artifact":{"bytes":4773,"path":"contracts/official-document-pack-seed.schema.json","sha256":"82d86a53e420836161b1fe901736d83315c7e265c42f7771e5d8bd8ce9785599"},"attestation_id":"official-document-pack-transformer-configuration","kind":"configuration"},{"artifact":{"bytes":5318,"path":"contracts/official-document-pack-builder-lock.json","sha256":"a28994dfb040464e571648ff292dfde722543a7e761e96bd4c26421ad613a7dc"},"attestation_id":"official-document-pack-transformer-dependency-lock","kind":"dependency-lock"}],"deterministic":true,"input_sha256":"87bfbdf1c9d1823f6c9c1e07909709c76e4accc32de6f7bc0aec1c913a0f6fb5","output_sha256":"b9b0ee45867932ea21768750ef61982992f53f570ab616a9ad29dc871e14c1df","processor_id":"official-document-pack-transformer","processor_version":"1.0"},"raw_source_extent_bytes":12144,"slices":[{"content":{"content_mode":"external-content","hash_basis":"external-receipt-bytes","locator":"https://huggingface.co/api/models/facebook/UMA","receipt":{"raw_bytes":12144,"raw_sha256":"87bfbdf1c9d1823f6c9c1e07909709c76e4accc32de6f7bc0aec1c913a0f6fb5","retrieval_method":"official-api","retrieved_utc":"2026-07-23T19:35:04Z","selected_content":{"bytes":12144,"sha256":"87bfbdf1c9d1823f6c9c1e07909709c76e4accc32de6f7bc0aec1c913a0f6fb5"}}},"loss_accounting":{"closure_status":"blocked","entries":[{"category":"asset","description":"The raw model card and reference configuration bodies were unavailable without gated access.","disposition":"unresolved","loss_id":"uma-gated-card-unavailable","severity":"blocking"},{"category":"asset","description":"No checkpoint bytes or artifact byte hashes were retrieved; repository revision is insufficient.","disposition":"unresolved","loss_id":"uma-weight-hashes-unavailable","severity":"blocking"}]},"raw_byte_range":{"byte_count":12144,"start_byte":0},"selector":{"kind":"whole-source","layer":"raw-source","value":"*"},"slice_id":"uma-public-api-metadata-whole","subject_ids":["uma.repository.identity","uma.repository.gated","uma.model.names.metadata","uma.model.artifact.gated","uma.weight.byte.identity.blocked","uma.model.card.blocked","uma.reference.yaml.blocked"]}],"source_identity":{"content_mode":"external-content","locator":"https://huggingface.co/api/models/facebook/UMA","receipt":{"raw_bytes":12144,"raw_sha256":"87bfbdf1c9d1823f6c9c1e07909709c76e4accc32de6f7bc0aec1c913a0f6fb5","retrieval_method":"official-api","retrieved_utc":"2026-07-23T19:35:04Z"}},"source_loss_accounting":{"closure_status":"blocked","entries":[{"category":"asset","description":"The raw model card and reference configuration bodies were unavailable without gated access.","disposition":"unresolved","loss_id":"uma-gated-card-unavailable","severity":"blocking"},{"category":"asset","description":"No checkpoint bytes or artifact byte hashes were retrieved; repository revision is insufficient.","disposition":"unresolved","loss_id":"uma-weight-hashes-unavailable","severity":"blocking"}]}}},"status":"blocked"}
