{"blockers":[{"code":"doc.body.bytes.external","description":"Official document bodies and per-page content hashes are not retained, so provider-required subjects remain blocked.","dimension":"loss-closure"},{"code":"doc.build.replay.missing","description":"Generated documentation and API build closure have not been deterministically replayed.","dimension":"loss-closure"},{"code":"loss-rendered-build-not-replayed","description":"The provider document projection has an unresolved blocking official-document loss: rendered-build-not-replayed.","dimension":"loss-closure"}],"contract_name":"document-slice-manifest","corpus_ref":{"corpus_id":"dft-structure-preparation-rdkit-docs-official-corpus","sha256":"1c150d01532a811d9d2bf89d4fcdb81fbdcd8587bfbe7cd1dd6e302a60e7411c"},"limitations":["Exact release Git-tree path and object identities are retained without official document bodies or generated rendered pages.","External raw identity is the SHA-256 of canonical sorted git ls-tree -r receipt lines '<mode> <object_type> <object_id>\\t<path>\\n' for every inventory entry; the local inventory JSON is metadata evidence only and contains no official document body bytes.","Slice projections are validated against the provider source partition.","The inventory identity binds the exact pre-migration catalog bytes as migration metadata; it does not identify any upstream document body.","This metadata inventory proves the bounded exact tree and path universe only; it does not prove rendered documentation completeness or provider behavior."],"producer":{"generated_utc":"2026-07-24T00:00:00Z","skill_id":"dft-structure-preparation","skill_version":"1.0","tool_id":"official-document-pack-builder","tool_version":"1.0"},"schema_version":"1.1","slice_manifest_id":"dft-structure-preparation-rdkit-docs-official-slices","sources":{"rdkit-exact-document-tree-inventory":{"processor":{"assurance_mode":"pinned","attestations":[{"artifact":{"bytes":184628,"path":"tools/build_official_document_packs.py","sha256":"e8cc4b4e3bf6ee7ceb736e563306ee769999d36f134cdb7a396ef7214274972f"},"attestation_id":"official-document-pack-transformer-implementation","kind":"implementation"},{"artifact":{"bytes":4773,"path":"contracts/official-document-pack-seed.schema.json","sha256":"82d86a53e420836161b1fe901736d83315c7e265c42f7771e5d8bd8ce9785599"},"attestation_id":"official-document-pack-transformer-configuration","kind":"configuration"},{"artifact":{"bytes":5039,"path":"contracts/official-document-pack-builder-lock.json","sha256":"3f8c0a577b8f1edb7bc4fe52849cfccc0b5dbc2c4350ea47521fa42fc36d48ff"},"attestation_id":"official-document-pack-transformer-dependency-lock","kind":"dependency-lock"}],"deterministic":true,"input_sha256":"ab204a184dc3d78644a9cb0caf8c239630a3fdf5330a6658bdc5a91624bc0294","output_sha256":"95367479701e3978f871f07b823614854df1e7a49739ad12f7e7311ee2e7c2bd","processor_id":"official-document-pack-transformer","processor_version":"1.0"},"raw_source_extent_bytes":55098,"slices":[{"content":{"content_mode":"external-content","hash_basis":"external-receipt-bytes","locator":"https://github.com/rdkit/rdkit/tree/Release_2026_03_4","receipt":{"raw_bytes":55098,"raw_sha256":"ab204a184dc3d78644a9cb0caf8c239630a3fdf5330a6658bdc5a91624bc0294","retrieval_method":"git-object","retrieved_utc":"2026-07-23T20:17:38Z","selected_content":{"bytes":55098,"sha256":"ab204a184dc3d78644a9cb0caf8c239630a3fdf5330a6658bdc5a91624bc0294"}}},"loss_accounting":{"closure_status":"blocked","entries":[{"category":"other","description":"Only exact Git object and path metadata are retained; official document body bytes remain external.","disposition":"external-only","loss_id":"document-bodies-not-retained","severity":"material"},{"category":"code","description":"The exact documentation build, generated API surfaces, and asset transformations have not been replayed.","disposition":"unresolved","loss_id":"rendered-build-not-replayed","severity":"blocking"}]},"raw_byte_range":{"byte_count":55098,"start_byte":0},"selector":{"kind":"whole-source","layer":"raw-source","value":"*"},"slice_id":"rdkit-exact-document-tree-inventory.whole","subject_ids":["rdkit-molecule-parse","rdkit-etkdg-conformers","rdkit-molfile-write"]}],"source_identity":{"content_mode":"external-content","locator":"https://github.com/rdkit/rdkit/tree/Release_2026_03_4","receipt":{"raw_bytes":55098,"raw_sha256":"ab204a184dc3d78644a9cb0caf8c239630a3fdf5330a6658bdc5a91624bc0294","retrieval_method":"git-object","retrieved_utc":"2026-07-23T20:17:38Z"}},"source_loss_accounting":{"closure_status":"blocked","entries":[{"category":"other","description":"Only exact Git object and path metadata are retained; official document body bytes remain external.","disposition":"external-only","loss_id":"document-bodies-not-retained","severity":"material"},{"category":"code","description":"The exact documentation build, generated API surfaces, and asset transformations have not been replayed.","disposition":"unresolved","loss_id":"rendered-build-not-replayed","severity":"blocking"}]}}},"status":"blocked"}
