{"blockers":[{"code":"cat.version.source_conflict","description":"Tag, package/module, and rolling-manual version surfaces disagree.","dimension":"loss-closure"},{"code":"doc.body.bytes.external","description":"Official document bodies and per-page content hashes are not retained.","dimension":"loss-closure"},{"code":"doc.build.replay.missing","description":"Generated Sphinx/API documentation has not been reproduced from the exact tag.","dimension":"loss-closure"},{"code":"loss-rendered-build-not-replayed","description":"The provider document projection has an unresolved blocking official-document loss: rendered-build-not-replayed.","dimension":"loss-closure"},{"code":"loss-version-surface-conflict","description":"The provider document projection has an unresolved blocking official-document loss: version-surface-conflict.","dimension":"loss-closure"}],"contract_name":"document-slice-manifest","corpus_ref":{"corpus_id":"catmap-microkinetics-catmap-docs-official-corpus","sha256":"1ebff0eead7a2fc9845173564b65d63de712f281bb0f738c80b23fc49150c3a9"},"limitations":["External raw identity is the SHA-256 of canonical sorted git ls-tree -r receipt lines '<mode> <object_type> <object_id>\\t<path>\\n' for every inventory entry; the local inventory JSON is metadata evidence only and contains no official document body bytes.","Slice projections are validated against the provider source partition.","The exact tag documentation/tutorial tree is inventoried as metadata only; executable tutorial artifacts and body bytes remain external.","The exact tag-tree inventory does not establish a version-consistent rendered manual, native runtime, solver behavior, numerical validity, or mechanism acceptance.","The inventory identity binds the exact pre-migration catalog bytes as migration metadata; it does not identify any upstream document body."],"producer":{"generated_utc":"2026-07-24T00:00:00Z","skill_id":"catmap-microkinetics","skill_version":"1.0","tool_id":"official-document-pack-builder","tool_version":"1.0"},"schema_version":"1.1","slice_manifest_id":"catmap-microkinetics-catmap-docs-official-slices","sources":{"catmap-exact-document-tree-inventory":{"processor":{"assurance_mode":"pinned","attestations":[{"artifact":{"bytes":184628,"path":"tools/build_official_document_packs.py","sha256":"e8cc4b4e3bf6ee7ceb736e563306ee769999d36f134cdb7a396ef7214274972f"},"attestation_id":"official-document-pack-transformer-implementation","kind":"implementation"},{"artifact":{"bytes":4773,"path":"contracts/official-document-pack-seed.schema.json","sha256":"82d86a53e420836161b1fe901736d83315c7e265c42f7771e5d8bd8ce9785599"},"attestation_id":"official-document-pack-transformer-configuration","kind":"configuration"},{"artifact":{"bytes":5039,"path":"contracts/official-document-pack-builder-lock.json","sha256":"8c974a232f007686ca64a0963dc994931aba2ddb23cff8fd18e0a9a6f12b4e8c"},"attestation_id":"official-document-pack-transformer-dependency-lock","kind":"dependency-lock"}],"deterministic":true,"input_sha256":"9eb80227d2555b7bb8105140183ba4c879ded3778b09d4943f8acefaf28f05c2","output_sha256":"0f818442488b31ef62338263094bf8e9ccbc00b31afdf18aa4624ecae168631f","processor_id":"official-document-pack-transformer","processor_version":"1.0"},"raw_source_extent_bytes":10008,"slices":[{"content":{"content_mode":"external-content","hash_basis":"external-receipt-bytes","locator":"https://github.com/SUNCAT-Center/catmap/tree/v0.4.1","receipt":{"raw_bytes":10008,"raw_sha256":"9eb80227d2555b7bb8105140183ba4c879ded3778b09d4943f8acefaf28f05c2","retrieval_method":"git-object","retrieved_utc":"2026-07-23T20:17:38Z","selected_content":{"bytes":10008,"sha256":"9eb80227d2555b7bb8105140183ba4c879ded3778b09d4943f8acefaf28f05c2"}}},"loss_accounting":{"closure_status":"blocked","entries":[{"category":"other","description":"Only exact Git path and object metadata are retained; documentation bodies remain external.","disposition":"external-only","loss_id":"document-bodies-not-retained","severity":"material"},{"category":"other","description":"Executable Python, mkm, log, and pickle-like tutorial surfaces are retained only as path metadata and are never executed or deserialized.","disposition":"external-only","loss_id":"executable-tutorials-excluded","severity":"material"},{"category":"code","description":"The Sphinx/API build and generated reference surface have not been replayed.","disposition":"unresolved","loss_id":"rendered-build-not-replayed","severity":"blocking"},{"category":"metadata","description":"The v0.4.1 tag, setup/module version 0.3.1, and rolling manual label 0.2.79 conflict and are not normalized into one identity.","disposition":"unresolved","loss_id":"version-surface-conflict","severity":"blocking"}]},"raw_byte_range":{"byte_count":10008,"start_byte":0},"selector":{"kind":"whole-source","layer":"raw-source","value":"*"},"slice_id":"catmap-exact-document-tree-inventory.whole","subject_ids":["feature.python.run-model","feature.python.single-point","feature.python.recalculate","feature.python.verify","feature.python.parse-table","feature.cli.import","feature.cli.graphviz","feature.cli.run-submission","feature.cli.inspect-log","feature.output.maps","feature.output.variables","feature.analysis.vector-map","feature.analysis.matrix-map","feature.analysis.mechanism","feature.thermo.interactions","feature.thermo.electrochemistry"]}],"source_identity":{"content_mode":"external-content","locator":"https://github.com/SUNCAT-Center/catmap/tree/v0.4.1","receipt":{"raw_bytes":10008,"raw_sha256":"9eb80227d2555b7bb8105140183ba4c879ded3778b09d4943f8acefaf28f05c2","retrieval_method":"git-object","retrieved_utc":"2026-07-23T20:17:38Z"}},"source_loss_accounting":{"closure_status":"blocked","entries":[{"category":"other","description":"Only exact Git path and object metadata are retained; documentation bodies remain external.","disposition":"external-only","loss_id":"document-bodies-not-retained","severity":"material"},{"category":"other","description":"Executable Python, mkm, log, and pickle-like tutorial surfaces are retained only as path metadata and are never executed or deserialized.","disposition":"external-only","loss_id":"executable-tutorials-excluded","severity":"material"},{"category":"code","description":"The Sphinx/API build and generated reference surface have not been replayed.","disposition":"unresolved","loss_id":"rendered-build-not-replayed","severity":"blocking"},{"category":"metadata","description":"The v0.4.1 tag, setup/module version 0.3.1, and rolling manual label 0.2.79 conflict and are not normalized into one identity.","disposition":"unresolved","loss_id":"version-surface-conflict","severity":"blocking"}]}}},"status":"blocked"}
