{"blockers":[{"code":"epw-exact-documentation-unbound","description":"Exact EPW mesh, restart, and Eliashberg-artifact documentation has not been enumerated and content-bound.","dimension":"loss-closure"},{"code":"loss-epw-exact-input-docs-unbound","description":"The provider document projection has an unresolved blocking official-document loss: epw-exact-input-docs-unbound.","dimension":"loss-closure"}],"contract_name":"document-slice-manifest","corpus_ref":{"corpus_id":"dft-campaign-efficiency-qe-phonon-epw-official-corpus","sha256":"45f3f64d232db187d838cf8540ef51e62611ff17192f2338bd9f2679f2f522b6"},"limitations":["Slice projections are validated against the provider source partition.","The inventory identity binds the exact pre-migration catalog bytes as migration metadata; it does not identify any upstream document body.","The selected PH and EPW sources do not enumerate the complete QE documentation universe.","This production seed stores metadata and receipts only and cannot assert complete coverage."],"producer":{"generated_utc":"2026-07-24T00:00:00Z","skill_id":"dft-campaign-efficiency","skill_version":"1.0","tool_id":"official-document-pack-builder","tool_version":"1.0"},"schema_version":"1.1","slice_manifest_id":"dft-campaign-efficiency-qe-phonon-epw-official-slices","sources":{"qe75-epw-readme":{"processor":{"assurance_mode":"pinned","attestations":[{"artifact":{"bytes":184689,"path":"tools/build_official_document_packs.py","sha256":"8f324b8bcf6881027f873838aa72df73f1b8029d7f77cc8fff1740215e40d4fc"},"attestation_id":"official-document-pack-transformer-implementation","kind":"implementation"},{"artifact":{"bytes":4773,"path":"contracts/official-document-pack-seed.schema.json","sha256":"82d86a53e420836161b1fe901736d83315c7e265c42f7771e5d8bd8ce9785599"},"attestation_id":"official-document-pack-transformer-configuration","kind":"configuration"},{"artifact":{"bytes":5318,"path":"contracts/official-document-pack-builder-lock.json","sha256":"a28994dfb040464e571648ff292dfde722543a7e761e96bd4c26421ad613a7dc"},"attestation_id":"official-document-pack-transformer-dependency-lock","kind":"dependency-lock"}],"deterministic":true,"input_sha256":"4224848ee2a2ba4556cadb2fd8235c8a514813ff56f105577e0c853e2d224fc5","output_sha256":"aee4a7c9010154c20bcd668d22774587e4d0a804fc2a5abc91df1a38440bcbe0","processor_id":"official-document-pack-transformer","processor_version":"1.0"},"raw_source_extent_bytes":4403,"slices":[{"content":{"content_mode":"external-content","hash_basis":"external-receipt-bytes","locator":"https://gitlab.com/QEF/q-e/-/raw/770a0b2d12928a67048e2f3da8d10d057e52179e/EPW/README","receipt":{"raw_bytes":4403,"raw_sha256":"4224848ee2a2ba4556cadb2fd8235c8a514813ff56f105577e0c853e2d224fc5","retrieval_method":"https-get","retrieved_utc":"2026-07-24T00:00:00Z","selected_content":{"bytes":4403,"sha256":"4224848ee2a2ba4556cadb2fd8235c8a514813ff56f105577e0c853e2d224fc5"}}},"loss_accounting":{"closure_status":"blocked","entries":[{"category":"metadata","description":"The QE 7.5 release tree identifies EPW 5.9, but this seed does not yet bind an exact complete EPW input-documentation corpus.","disposition":"unresolved","loss_id":"epw-exact-input-docs-unbound","severity":"blocking"}]},"raw_byte_range":{"byte_count":4403,"start_byte":0},"selector":{"kind":"whole-source","layer":"raw-source","value":"*"},"slice_id":"qe75-epw-readme-whole","subject_ids":["qe-epw-coarse-fine-restart-artifacts"]}],"source_identity":{"content_mode":"external-content","locator":"https://gitlab.com/QEF/q-e/-/raw/770a0b2d12928a67048e2f3da8d10d057e52179e/EPW/README","receipt":{"raw_bytes":4403,"raw_sha256":"4224848ee2a2ba4556cadb2fd8235c8a514813ff56f105577e0c853e2d224fc5","retrieval_method":"https-get","retrieved_utc":"2026-07-24T00:00:00Z"}},"source_loss_accounting":{"closure_status":"blocked","entries":[{"category":"metadata","description":"The QE 7.5 release tree identifies EPW 5.9, but this seed does not yet bind an exact complete EPW input-documentation corpus.","disposition":"unresolved","loss_id":"epw-exact-input-docs-unbound","severity":"blocking"}]}},"qe75-input-ph":{"processor":{"assurance_mode":"pinned","attestations":[{"artifact":{"bytes":184689,"path":"tools/build_official_document_packs.py","sha256":"8f324b8bcf6881027f873838aa72df73f1b8029d7f77cc8fff1740215e40d4fc"},"attestation_id":"official-document-pack-transformer-implementation","kind":"implementation"},{"artifact":{"bytes":4773,"path":"contracts/official-document-pack-seed.schema.json","sha256":"82d86a53e420836161b1fe901736d83315c7e265c42f7771e5d8bd8ce9785599"},"attestation_id":"official-document-pack-transformer-configuration","kind":"configuration"},{"artifact":{"bytes":5318,"path":"contracts/official-document-pack-builder-lock.json","sha256":"a28994dfb040464e571648ff292dfde722543a7e761e96bd4c26421ad613a7dc"},"attestation_id":"official-document-pack-transformer-dependency-lock","kind":"dependency-lock"}],"deterministic":true,"input_sha256":"419948c44e7695ddc70100070a39524b0bebbb70e07561ac3f39fc2cece9ff39","output_sha256":"4f7eada9e93c9cf264e8d2433a970df7c7ac14a80ba44d9e930d781813106ead","processor_id":"official-document-pack-transformer","processor_version":"1.0"},"raw_source_extent_bytes":96464,"slices":[{"content":{"content_mode":"external-content","hash_basis":"external-receipt-bytes","locator":"https://gitlab.com/QEF/q-e/-/raw/770a0b2d12928a67048e2f3da8d10d057e52179e/PHonon/Doc/INPUT_PH.html","receipt":{"raw_bytes":96464,"raw_sha256":"419948c44e7695ddc70100070a39524b0bebbb70e07561ac3f39fc2cece9ff39","retrieval_method":"https-get","retrieved_utc":"2026-07-24T00:00:00Z","selected_content":{"bytes":96464,"sha256":"419948c44e7695ddc70100070a39524b0bebbb70e07561ac3f39fc2cece9ff39"}}},"loss_accounting":{"closure_status":"complete","entries":[]},"raw_byte_range":{"byte_count":96464,"start_byte":0},"selector":{"kind":"whole-source","layer":"raw-source","value":"*"},"slice_id":"qe75-input-ph-whole","subject_ids":["qe-ph-electron-phonon","qe-ph-last-q","qe-ph-lqdir","qe-ph-lshift-q","qe-ph-only-init","qe-ph-recover","qe-ph-start-q","qe-ph-trans-false"]}],"source_identity":{"content_mode":"external-content","locator":"https://gitlab.com/QEF/q-e/-/raw/770a0b2d12928a67048e2f3da8d10d057e52179e/PHonon/Doc/INPUT_PH.html","receipt":{"raw_bytes":96464,"raw_sha256":"419948c44e7695ddc70100070a39524b0bebbb70e07561ac3f39fc2cece9ff39","retrieval_method":"https-get","retrieved_utc":"2026-07-24T00:00:00Z"}},"source_loss_accounting":{"closure_status":"complete","entries":[]}},"qe75-phonon-guide":{"processor":{"assurance_mode":"pinned","attestations":[{"artifact":{"bytes":184689,"path":"tools/build_official_document_packs.py","sha256":"8f324b8bcf6881027f873838aa72df73f1b8029d7f77cc8fff1740215e40d4fc"},"attestation_id":"official-document-pack-transformer-implementation","kind":"implementation"},{"artifact":{"bytes":4773,"path":"contracts/official-document-pack-seed.schema.json","sha256":"82d86a53e420836161b1fe901736d83315c7e265c42f7771e5d8bd8ce9785599"},"attestation_id":"official-document-pack-transformer-configuration","kind":"configuration"},{"artifact":{"bytes":5318,"path":"contracts/official-document-pack-builder-lock.json","sha256":"a28994dfb040464e571648ff292dfde722543a7e761e96bd4c26421ad613a7dc"},"attestation_id":"official-document-pack-transformer-dependency-lock","kind":"dependency-lock"}],"deterministic":true,"input_sha256":"aed53913042c2732172137194ca7e86aba3ce301665d15d79c2720b1bc146f60","output_sha256":"2d17d062b9d9f15dbf7ab5a73ba15f9cca1fed8adf13cc1322ee9f1324e23056","processor_id":"official-document-pack-transformer","processor_version":"1.0"},"raw_source_extent_bytes":239679,"slices":[{"content":{"content_mode":"external-content","hash_basis":"external-receipt-bytes","locator":"https://gitlab.com/QEF/q-e/-/raw/770a0b2d12928a67048e2f3da8d10d057e52179e/PHonon/Doc/user_guide.pdf","receipt":{"raw_bytes":239679,"raw_sha256":"aed53913042c2732172137194ca7e86aba3ce301665d15d79c2720b1bc146f60","retrieval_method":"https-get","retrieved_utc":"2026-07-24T00:00:00Z","selected_content":{"bytes":239679,"sha256":"aed53913042c2732172137194ca7e86aba3ce301665d15d79c2720b1bc146f60"}}},"loss_accounting":{"closure_status":"complete","entries":[]},"raw_byte_range":{"byte_count":239679,"start_byte":0},"selector":{"kind":"whole-source","layer":"raw-source","value":"*"},"slice_id":"qe75-phonon-guide-whole","subject_ids":["qe-q2r-shifted-grid-limit"]}],"source_identity":{"content_mode":"external-content","locator":"https://gitlab.com/QEF/q-e/-/raw/770a0b2d12928a67048e2f3da8d10d057e52179e/PHonon/Doc/user_guide.pdf","receipt":{"raw_bytes":239679,"raw_sha256":"aed53913042c2732172137194ca7e86aba3ce301665d15d79c2720b1bc146f60","retrieval_method":"https-get","retrieved_utc":"2026-07-24T00:00:00Z"}},"source_loss_accounting":{"closure_status":"complete","entries":[]}}},"status":"blocked"}
